{
  "schema_version": 1,
  "id": "st7789-320x240-landscape-v1",
  "controller": "st7789",
  "physical": {"width": 240, "height": 320},
  "logical": {"width": 320, "height": 240},
  "transform": {"swap_xy": true, "mirror_x": true, "mirror_y": false},
  "offset": {"x": 0, "y": 0},
  "color_order": "rgb",
  "invert_color": true,
  "spi": {"host": 3, "mode": 0, "frequency_hz": 40000000, "queue_depth": 10},
  "emote_assets": {
    "directory": "emote_landscape",
    "binary": "hensun_emote_landscape_v1.bin",
    "manifest": "manifest.json"
  }
}
